{
  "capability_id": "capability-disposition-qualification",
  "catalog_hash": "sha256:1bc2c22639e5e1e22920673bb5f4423b59bda6ab05732cb3c1300499db7b6693",
  "duplicate_test_count": 0,
  "executed_test_count": 12,
  "expected_test_count": 12,
  "failed_test_count": 0,
  "implementation_path_set_hash": "sha256:33b28a16a9117f65bf3562fd3aff838c4d698b65e7fea12d02c5aa588efcba6d",
  "missing_test_count": 0,
  "patch_ledger_set_hash": "sha256:fab9acdccdbc9b42d7ecad8b014e72a50a036c076b5130ec7cb801c2d76c2b4d",
  "required_test_manifest": {
    "digest": "sha256:2d62c14d670455eee2711572f1d3c84523443044ee0f2d52947d5de4d6056202",
    "logical_name": "capability-disposition-post-disposition-test-manifest",
    "media_type": "application/json",
    "relative_path": "pmorg/capabilities/capability-disposition-post-disposition-test-manifest-v1.json",
    "size_bytes": 5585
  },
  "schema_version": "pmorg.post-disposition-qualification/v1",
  "test_evidence": [
    {
      "result": {
        "digest": "sha256:f45820bc2e45858ef4876b2a7b391ba8c7a46a1b36c7c1861decae1bd35f265f",
        "logical_name": "capability-disposition-qualification::TestQualificationOracles.test_binding_and_committed_output_drift_fail_closed-result",
        "media_type": "application/json",
        "relative_path": "pmorg/capabilities/capability-disposition-post-disposition-test-results/TestQualificationOracles__test_binding_and_committed_output_drift_fail_closed.json",
        "size_bytes": 1809
      },
      "test_id": "capability-disposition-qualification::TestQualificationOracles.test_binding_and_committed_output_drift_fail_closed",
      "test_manifest": {
        "digest": "sha256:2d62c14d670455eee2711572f1d3c84523443044ee0f2d52947d5de4d6056202",
        "logical_name": "capability-disposition-post-disposition-test-manifest",
        "media_type": "application/json",
        "relative_path": "pmorg/capabilities/capability-disposition-post-disposition-test-manifest-v1.json",
        "size_bytes": 5585
      },
      "verdict": "pass"
    },
    {
      "result": {
        "digest": "sha256:52eb1f1df51f425e0428794eed63658c7e9bfbc4535da80325761007a917f9eb",
        "logical_name": "capability-disposition-qualification::TestQualificationOracles.test_global_gates_are_preserved_but_never_candidate_executable-result",
        "media_type": "application/json",
        "relative_path": "pmorg/capabilities/capability-disposition-post-disposition-test-results/TestQualificationOracles__test_global_gates_are_preserved_but_never_candidate_executable.json",
        "size_bytes": 1831
      },
      "test_id": "capability-disposition-qualification::TestQualificationOracles.test_global_gates_are_preserved_but_never_candidate_executable",
      "test_manifest": {
        "digest": "sha256:2d62c14d670455eee2711572f1d3c84523443044ee0f2d52947d5de4d6056202",
        "logical_name": "capability-disposition-post-disposition-test-manifest",
        "media_type": "application/json",
        "relative_path": "pmorg/capabilities/capability-disposition-post-disposition-test-manifest-v1.json",
        "size_bytes": 5585
      },
      "verdict": "pass"
    },
    {
      "result": {
        "digest": "sha256:29ecdd8289812f73319ca9be9681dc20b9f3b5123c4ab98a1e9f1eb8b8824e80",
        "logical_name": "capability-disposition-qualification::TestQualificationOracles.test_policy_is_closed_content_addressed_and_deterministic-result",
        "media_type": "application/json",
        "relative_path": "pmorg/capabilities/capability-disposition-post-disposition-test-results/TestQualificationOracles__test_policy_is_closed_content_addressed_and_deterministic.json",
        "size_bytes": 1821
      },
      "test_id": "capability-disposition-qualification::TestQualificationOracles.test_policy_is_closed_content_addressed_and_deterministic",
      "test_manifest": {
        "digest": "sha256:2d62c14d670455eee2711572f1d3c84523443044ee0f2d52947d5de4d6056202",
        "logical_name": "capability-disposition-post-disposition-test-manifest",
        "media_type": "application/json",
        "relative_path": "pmorg/capabilities/capability-disposition-post-disposition-test-manifest-v1.json",
        "size_bytes": 5585
      },
      "verdict": "pass"
    },
    {
      "result": {
        "digest": "sha256:c581d0418ecf4dec797e21096715827f44d395b0d71387f1fe7572b71ebda0d4",
        "logical_name": "capability-disposition-qualification::TestQualificationOracles.test_unexecutable_or_status_forged_result_cannot_pass-result",
        "media_type": "application/json",
        "relative_path": "pmorg/capabilities/capability-disposition-post-disposition-test-results/TestQualificationOracles__test_unexecutable_or_status_forged_result_cannot_pass.json",
        "size_bytes": 1813
      },
      "test_id": "capability-disposition-qualification::TestQualificationOracles.test_unexecutable_or_status_forged_result_cannot_pass",
      "test_manifest": {
        "digest": "sha256:2d62c14d670455eee2711572f1d3c84523443044ee0f2d52947d5de4d6056202",
        "logical_name": "capability-disposition-post-disposition-test-manifest",
        "media_type": "application/json",
        "relative_path": "pmorg/capabilities/capability-disposition-post-disposition-test-manifest-v1.json",
        "size_bytes": 5585
      },
      "verdict": "pass"
    },
    {
      "result": {
        "digest": "sha256:cc4a9b544951c29da0176d1accc48f72d85f6298e37563ca8722f8c8886e79a4",
        "logical_name": "capability-disposition-qualification::TestQualificationSigning.test_bqa_rejects_binding_and_deadline_escape-result",
        "media_type": "application/json",
        "relative_path": "pmorg/capabilities/capability-disposition-post-disposition-test-results/TestQualificationSigning__test_bqa_rejects_binding_and_deadline_escape.json",
        "size_bytes": 1795
      },
      "test_id": "capability-disposition-qualification::TestQualificationSigning.test_bqa_rejects_binding_and_deadline_escape",
      "test_manifest": {
        "digest": "sha256:2d62c14d670455eee2711572f1d3c84523443044ee0f2d52947d5de4d6056202",
        "logical_name": "capability-disposition-post-disposition-test-manifest",
        "media_type": "application/json",
        "relative_path": "pmorg/capabilities/capability-disposition-post-disposition-test-manifest-v1.json",
        "size_bytes": 5585
      },
      "verdict": "pass"
    },
    {
      "result": {
        "digest": "sha256:8d17c95bb09a6efecfe63c7879505c84681cfcf6cc210f104e06140e81fd58e5",
        "logical_name": "capability-disposition-qualification::TestQualificationSigning.test_bqa_rejects_missing_key_multiple_signatures_and_schema_drift-result",
        "media_type": "application/json",
        "relative_path": "pmorg/capabilities/capability-disposition-post-disposition-test-results/TestQualificationSigning__test_bqa_rejects_missing_key_multiple_signatures_and_schema_drift.json",
        "size_bytes": 1837
      },
      "test_id": "capability-disposition-qualification::TestQualificationSigning.test_bqa_rejects_missing_key_multiple_signatures_and_schema_drift",
      "test_manifest": {
        "digest": "sha256:2d62c14d670455eee2711572f1d3c84523443044ee0f2d52947d5de4d6056202",
        "logical_name": "capability-disposition-post-disposition-test-manifest",
        "media_type": "application/json",
        "relative_path": "pmorg/capabilities/capability-disposition-post-disposition-test-manifest-v1.json",
        "size_bytes": 5585
      },
      "verdict": "pass"
    },
    {
      "result": {
        "digest": "sha256:552336819cd117b637ebab4db157fe45109772172c7cb363e5b98144d0685dc0",
        "logical_name": "capability-disposition-qualification::TestQualificationSigning.test_bqa_rejects_tampering_wrong_key_and_type-result",
        "media_type": "application/json",
        "relative_path": "pmorg/capabilities/capability-disposition-post-disposition-test-results/TestQualificationSigning__test_bqa_rejects_tampering_wrong_key_and_type.json",
        "size_bytes": 1797
      },
      "test_id": "capability-disposition-qualification::TestQualificationSigning.test_bqa_rejects_tampering_wrong_key_and_type",
      "test_manifest": {
        "digest": "sha256:2d62c14d670455eee2711572f1d3c84523443044ee0f2d52947d5de4d6056202",
        "logical_name": "capability-disposition-post-disposition-test-manifest",
        "media_type": "application/json",
        "relative_path": "pmorg/capabilities/capability-disposition-post-disposition-test-manifest-v1.json",
        "size_bytes": 5585
      },
      "verdict": "pass"
    },
    {
      "result": {
        "digest": "sha256:a6c1dd2b91ebb34ffa573859eb626fb6cf148171264bafa60a91301189015880",
        "logical_name": "capability-disposition-qualification::TestQualificationSigning.test_bqa_round_trip_is_deterministic_and_schema_bound-result",
        "media_type": "application/json",
        "relative_path": "pmorg/capabilities/capability-disposition-post-disposition-test-results/TestQualificationSigning__test_bqa_round_trip_is_deterministic_and_schema_bound.json",
        "size_bytes": 1813
      },
      "test_id": "capability-disposition-qualification::TestQualificationSigning.test_bqa_round_trip_is_deterministic_and_schema_bound",
      "test_manifest": {
        "digest": "sha256:2d62c14d670455eee2711572f1d3c84523443044ee0f2d52947d5de4d6056202",
        "logical_name": "capability-disposition-post-disposition-test-manifest",
        "media_type": "application/json",
        "relative_path": "pmorg/capabilities/capability-disposition-post-disposition-test-manifest-v1.json",
        "size_bytes": 5585
      },
      "verdict": "pass"
    },
    {
      "result": {
        "digest": "sha256:ce1d9175a749df269bbc73982e2ee2b85ac3e6c3d7ad1ef34cbefeaf39b2e355",
        "logical_name": "capability-disposition-qualification::TestQualificationSigning.test_bqm_is_content_addressed_exact_and_offline_resolvable-result",
        "media_type": "application/json",